{
  "schemaVersion": "1.1.0",
  "profile": "field-app",
  "dials": {
    "correctness_bar": "append-only",
    "sensitivity": "protected",
    "infra": "vercel",
    "runtime": "ts-nextjs",
    "topology": "single-app",
    "walkthrough": "live"
  },
  "invariants": [
    "observations_append_only_never_delete",
    "geo_coordinate_fuzzing_public_views",
    "a11y_axe_clean",
    "observation_id_uniqueness",
    "session_expires_event_plus_24hrs"
  ],
  "patterns": [
    "nextjs-app-router",
    "react-hook-form-zod",
    "zustand-offline-queue",
    "pwa-manifest",
    "prisma-postgis"
  ],
  "risk_assessment": {
    "feasibility": "high",
    "estimated_budget_usd": 150,
    "estimated_infra_monthly_usd": 50,
    "timeline_risk": "medium",
    "mitigations": [
      "start_with_mvp",
      "defer_admin_dashboard"
    ]
  }
}
